{
  "email":"email@gmail.com",
  "languageName": "Português",
  "linkedin": "https://www.linkedin.com/in/daniloneto/",
  "nome": "Danilo Neto",
  "nomeArquivoSaida": "Curriculo_Danilo_Neto.docx",
  "secoes": {
    "certificacoes": {
      "lista": [
        "Microsoft Certified: Azure Data Fundamentals",
        "AWS Certified Cloud Practitioner",
        "Accenture Technology Architecture Associate",
        "Mongo SI Associate Certification",
        "Foundational C# with Microsoft",
        "Microsoft Certified MTA: Software Development Fundamentals"
      ],
      "titulo": "Certificações"
    },
    "educacao": {
      "formacao": [
        "MBA em Gestão da Informação - Universidade Salvador (2009-2010)",
        "Bacharelado em Sistemas de Informação - Universidade Salvador (2002-2007)"
      ],
      "titulo": "Educação"
    },
    "emAndamento": {
      "cursos": [
        "Curso de inglês Berlitz",
        "Certificação Github Copilot"
      ],
      "titulo": "Em Andamento"
    },
    "experienciaProfissional": {
      "empregos": [
        {
          "cargo": "Consultor de Desenvolvimento Sênior - Avanade",
          "descricao": [
            "Liderança técnica de time (7 devs), revisão de código, práticas de entrega.",
            "APIs REST escaláveis e resilientes (Node.js, Arquitetura Hexagonal, Java/Spring Batch).",
            "Stack AWS Serverless: Lambda, DynamoDB, RDS Postgres, EventBridge, SQS, API Gateway, S3.",
            "Observabilidade: Dynatrace, testes de performance K6.",
            "SRE, confiabilidade e automação de processos.",
            "Projetos anteriores: Azure, C# .NET Core, Angular/TypeScript, Azure Service Bus, TDD, DDD."
          ],
          "periodo": "Abr/2021 - Presente"
        },
        {
          "cargo": "Analista de Sistemas Sênior - SENAR AR/BA",
          "descricao": [
            "Desenvolvimento em C#, ASP.NET MVC, Flutter, SQLite.",
            "DevOps, Git, automação."
          ],
          "periodo": "Out/2017 - Abr/2021"
        },
        {
          "cargo": "Outros cargos:",
          "descricao": [
            "Analista de Sistemas - Open System (Jul/2017-Out/2017)",
            "Analista de Sistemas - Tao Interativa (Out/2016-Jul/2017)",
            "Desenvolvedor Mobile - Safeticket (Dez/2015-Jul/2017)",
            "Desenvolvedor - Indra (Abr/2015-Dez/2015)",
            "Consultoria Independente (Ago/2010-Abr/2015)",
            "Professor substituto - IFBAIANO (Nov/2013-Set/2014)",
            "Analista de sistemas - Expressa (Jun/2007-Ago/2010)",
            "Desenvolvedor Pleno - CPM Braxis/Capgemini (Dez/2004-Jun/2007)",
            "Desenvolvedor Júnior - M4F (Jul/2004-Dez/2004)",
            "Estagiário - Rádio Metrópole (2003)"
          ],
          "periodo": ""
        }
      ],
      "titulo": "Experiência Profissional"
    },
    "habilidadesTecnicas": {
      "habilidades": [
        {
          "nivel": 5,
          "nome": "C#"
        },
        {
          "nivel": 5,
          "nome": "Node.js"
        },
        {
          "nivel": 4,
          "nome": "Java / Spring Boot"
        },
        {
          "nivel": 5,
          "nome": "AWS"
        },
        {
          "nivel": 4,
          "nome": "Azure"
        },
        {
          "nivel": 5,
          "nome": "SQL Server"
        },
        {
          "nivel": 4,
          "nome": "PostgreSQL"
        },
        {
          "nivel": 3,
          "nome": "MongoDB"
        },
        {
          "nivel": 2,
          "nome": "Angular"
        },
        {
          "nivel": 2,
          "nome": "Flutter"
        },
        {
          "nivel": 5,
          "nome": "DDD"
        },
        {
          "nivel": 5,
          "nome": "Microsserviços"
        },
        {
          "nivel": 4,
          "nome": "TDD"
        },
        {
          "nivel": 3,
          "nome": "SRE"
        },
        {
          "nivel": 4,
          "nome": "Docker"
        },
        {
          "nivel": 2,
          "nome": "Kubernetes"
        },
        {
          "nivel": 4,
          "nome": "CI/CD"
        },
        {
          "nivel": 5,
          "nome": "Git"
        },
        {
          "nivel": 5,
          "nome": "Agile / Scrum"
        },
        {
          "nivel": 5,
          "nome": "Azure DevOps"
        },
        {
          "nivel": 5,
          "nome": "Github Copilot"
        }
      ],
      "titulo": "Habilidades Técnicas"
    },
    "resumoProfissional": {
      "conteudo": "Sou um profissional com forte base técnica em back-end e arquitetura de soluções, com foco em ambientes cloud (Azure e AWS), microserviços e sistemas distribuídos. Consultor Sênior na Avanade, atuando em desenho técnico, liderança de times e entrega de soluções robustas.\n\nPerfil T-Shaped: profundidade técnica (C#, Node.js, Java/Spring Boot), facilidade em transitar por produto, operação e estratégia. Motivado por sistemas bem estruturados, decisões sólidas e evolução consistente dos times.",
      "titulo": "Resumo Profissional"
    }
  },
  "telefone": "00-0000-0000"
}